{
  "additiveExpansion": {
    "catalogEntryIds": [],
    "standaloneTargetRows": []
  },
  "catalogNormalization": {
    "canonicalPlatformCount": 226,
    "catalogEntryCount": 403,
    "countRationale": "403 catalog identities - 178 explicit variants + 1 Mimir-native platforms = 226 canonical/provisional platforms",
    "fixtures": [
      {
        "catalogEntryId": "shipping-catalog:nintendo_wii_rvl_201",
        "expectedPlatformId": "nintendo_wii",
        "expectedRelation": "HARDWARE_VARIANT",
        "observedPlatformId": "nintendo_wii",
        "observedRelation": "HARDWARE_VARIANT",
        "status": "PASS"
      },
      {
        "catalogEntryId": "shipping-catalog:sony_playstation_2_scph_70000",
        "expectedPlatformId": "ps2",
        "expectedRelation": "HARDWARE_VARIANT",
        "observedPlatformId": "ps2",
        "observedRelation": "HARDWARE_VARIANT",
        "status": "PASS"
      },
      {
        "catalogEntryId": "shipping-catalog:neo_geo",
        "expectedPlatformId": "snk_neo_geo",
        "expectedRelation": "CONTENT_VARIANT",
        "observedPlatformId": "snk_neo_geo",
        "observedRelation": "CONTENT_VARIANT",
        "status": "PASS"
      },
      {
        "catalogEntryId": "shipping-catalog:nintendo_switch_hac_001",
        "expectedPlatformId": "switch",
        "expectedRelation": "HARDWARE_VARIANT",
        "observedPlatformId": "switch",
        "observedRelation": "HARDWARE_VARIANT",
        "status": "PASS"
      },
      {
        "catalogEntryId": "shipping-catalog:nintendo_e_reader",
        "expectedPlatformId": "gba",
        "expectedRelation": "HARDWARE_VARIANT",
        "observedPlatformId": "gba",
        "observedRelation": "HARDWARE_VARIANT",
        "status": "PASS"
      },
      {
        "catalogEntryId": "shipping-catalog:sony_playstation_portable_psx2psp",
        "expectedPlatformId": "ps1",
        "expectedRelation": "CONTENT_VARIANT",
        "observedPlatformId": "ps1",
        "observedRelation": "CONTENT_VARIANT",
        "status": "PASS"
      },
      {
        "catalogEntryId": "shipping-catalog:apple_macintosh_beta",
        "expectedPlatformId": "apple_macintosh",
        "expectedRelation": "CONTENT_VARIANT",
        "observedPlatformId": "apple_macintosh",
        "observedRelation": "CONTENT_VARIANT",
        "status": "PASS"
      },
      {
        "catalogEntryId": "shipping-catalog:mattel_hyperscan_alt",
        "expectedPlatformId": "mattel_hyperscan",
        "expectedRelation": "PRESENTATION_ALIAS",
        "observedPlatformId": "mattel_hyperscan",
        "observedRelation": "PRESENTATION_ALIAS",
        "status": "PASS"
      },
      {
        "catalogEntryId": "shipping-catalog:sony_playstation_scph_100_131_flat",
        "expectedPlatformId": "ps1",
        "expectedRelation": "PRESENTATION_ALIAS",
        "observedPlatformId": "ps1",
        "observedRelation": "PRESENTATION_ALIAS",
        "status": "PASS"
      },
      {
        "catalogEntryId": "shipping-catalog:vtech_socrates_alt",
        "expectedPlatformId": "vtech_socrates",
        "expectedRelation": "PRESENTATION_ALIAS",
        "observedPlatformId": "vtech_socrates",
        "observedRelation": "PRESENTATION_ALIAS",
        "status": "PASS"
      },
      {
        "catalogEntryId": "shipping-catalog:sega_mega_drive_genesis_kr",
        "expectedPlatformId": "genesis",
        "expectedRelation": "REGIONAL_VARIANT",
        "observedPlatformId": "genesis",
        "observedRelation": "REGIONAL_VARIANT",
        "status": "PASS"
      }
    ],
    "relationCounts": {
      "CANONICAL": 225,
      "CONTENT_VARIANT": 37,
      "HARDWARE_VARIANT": 137,
      "PRESENTATION_ALIAS": 3,
      "REGIONAL_VARIANT": 1,
      "SOFTWARE_FAMILY": 0
    },
    "relationFixtureSha256": "bc8e769312f97845c3accd778142411911679e805d1a8bf42b6baf5c54423461"
  },
  "catalogPartition": {
    "disjointSetNames": [
      "A287_CATALOG_ONLY",
      "D59_DISCOVERY_ONLY",
      "R10_DISCOVERY_GAP",
      "DR47_DISCOVERY_RUNTIME"
    ],
    "unionCount": 403,
    "unionIdsSha256": "4b7599a3c47b941618e76a433a18e9d8ee69476baba685e6084cc7bf200f561e"
  },
  "compatibilityFloor": "pk00-source-only.v1",
  "digests": {
    "algorithm": "SHA-256",
    "canonicalization": "mimir-canonical-json-v1",
    "manifestPayloadSha256": "150a7999e746f4bb0417008d9d0a01acc177ce1fa0474911de8568eef239abb5",
    "setIds": {
      "A287_CATALOG_ONLY": "d0d5d214e1bd9e17eef85f2e9abbe9e10a0629e8faba44ba054b4e503a3d2af1",
      "B21": "120a4f3cb348b4ff7070517c6c4022323c0aa229308827e43d1c27275e1742e8",
      "D59_DISCOVERY_ONLY": "46250a50869727e850d125a63af2eafb57d9cc4a063a3902f0434b5f540c19c8",
      "DR47_DISCOVERY_RUNTIME": "a714a05fdff6b6ec2d0490c075ae4986ad1e4cee713419a6d11b8b8ade312d8a",
      "R10_DISCOVERY_GAP": "89b9ed93b2098d57088190a9e88b87f82a89f25393ed62828e42a0038e110cca",
      "R39_DISCOVERABLE": "ca5358ceba02501522645dc36af705c8ebcf625316e1e9fcafe5fccf5af0d447",
      "R49": "4e79d6efea1dbf183b2450fcdad627f340d5629708b275f15119007dc3d3b41b"
    },
    "standalonePackageNamesSha256": "9a592fd4211c4275e39359ea78bc550aba410175b2ee6b447b553d46a7a65385",
    "standaloneTargetRowsSha256": "5452efe1d10e4a27e996bdca4d4306593475be198f1fa72b3a92741f2e37d8c0"
  },
  "generatedBy": "tools/platform-registry/generate-platform-registry.mjs",
  "idMapVersion": "mimirPlatformIdMap.v1",
  "lockedInputSetSha256": "97f39e7ed118723f94ca66fb1be83465705118db6dd4585f57942560b2c7571c",
  "registryRevision": "pk00-b34752d0290e-985b39fabddf",
  "registrySemanticOutputSha256": "e03bfd69ab9a86f426115a0a0cb6d66feb3ff7c1e54776c6d627b4e6f9b6be89",
  "schemaVersion": "mimirPlatformSupportSetManifest.v1",
  "sets": {
    "A287_CATALOG_ONLY": {
      "count": 287,
      "ids": [
        "1292_advanced_programmable_video_system",
        "acorn_archimedes",
        "acorn_atom",
        "acorn_atom_tapes",
        "acorn_bbc_micro",
        "acorn_risc_pc",
        "act_apricot_pc_xi",
        "amazon_fire_tv",
        "amazon_fire_tv_2nd_gen",
        "amazon_fire_tv_3rd_gen",
        "amazon_fire_tv_cube",
        "amazon_luna",
        "amstrad_gx4000",
        "apf_imagination_machine",
        "apf_mp_1000",
        "apple_bandai_pippin",
        "apple_i",
        "apple_i_tapes",
        "apple_ii",
        "apple_ii_plus",
        "apple_iie",
        "apple_iigs",
        "apple_macintosh",
        "apple_macintosh_beta",
        "arduboy_inc_arduboy",
        "atari_pong",
        "atari_pong_c_140",
        "atari_pong_c_200",
        "atari_st",
        "atari_st_tapes",
        "atari_vcs",
        "atari_xegs",
        "atomiswave",
        "bally_astrocade",
        "bally_astrocade_tapes",
        "bandai_design_master_denshi_mangajuku",
        "bandai_gundam_rx_78",
        "bandai_playdia",
        "bandai_super_vision_8000",
        "bandai_terebikko",
        "bbc_bridge_companion",
        "benesse_pocket_challenge_v2",
        "benesse_pocket_challenge_w",
        "bit_corporation_gamate",
        "capcom_cp_system_i",
        "capcom_cp_system_ii",
        "capcom_cp_system_iii",
        "casio_loopy",
        "casio_pv_1000",
        "chip_8",
        "coleco_telstar_6030",
        "coleco_telstar_6040",
        "coleco_telstar_6045",
        "coleco_telstar_6065",
        "coleco_telstar_6071",
        "coleco_telstar_6135",
        "commodore_128",
        "commodore_cdtv",
        "commodore_pet",
        "commodore_plus_4",
        "connor_videosmarts",
        "digital_media_cartridge_firecore",
        "digital_media_cartridge_firecore_portable_2",
        "emerson_arcadia_2001",
        "entex_adventure_vision",
        "entex_select_a_game",
        "epoch_cassette_vision",
        "epoch_cassette_vision_jr",
        "epoch_game_pocket_computer",
        "epoch_super_cassette_vision",
        "epoch_tv_tennis_electrotennis",
        "fairchild_channel_f",
        "fairchild_channel_f_system_ii",
        "fbneo_arcade_games",
        "fujitsu_fm_7",
        "fujitsu_fm_7_tapes",
        "fujitsu_fm_towns",
        "fujitsu_fm_towns_marty",
        "fukutake_publishing_studybox",
        "funtech_super_acan",
        "gakken_compact_vision_tv_boy",
        "gamepark_caanoo",
        "gamepark_gp2x",
        "gamepark_gp2x_digital",
        "gamepark_gp2x_f200",
        "gamepark_gp2x_wiz",
        "gamepark_gp32",
        "google_nexus_player",
        "google_stadia",
        "handheld_electronic_game",
        "hartung_game_master",
        "hbmame",
        "hitachi_s1",
        "infocom_z_machine",
        "intellivision_amico",
        "interton_vc_4000",
        "interton_video_2000",
        "ique_ique",
        "konami_picno",
        "leapfrog_explorer",
        "leapfrog_leappad",
        "leapfrog_leapster_learning_game_system",
        "leapfrog_leapster_learning_game_system_1",
        "leapfrog_my_first_leappad",
        "ljn_video_art",
        "lowres_nx",
        "lutro",
        "luxor_abc_800",
        "magnavox_odyssey",
        "magnavox_odyssey_100",
        "magnavox_odyssey_200",
        "magnavox_odyssey_2000",
        "magnavox_odyssey_2001",
        "magnavox_odyssey_2100",
        "magnavox_odyssey_300",
        "magnavox_odyssey_3000",
        "magnavox_odyssey_400",
        "magnavox_odyssey_4000",
        "magnavox_odyssey_500",
        "magnavox_odyssey2",
        "mame_2000",
        "mame_2003",
        "mame_2003_plus",
        "mame_2010",
        "mame_2015",
        "mame_2016",
        "mattel_hyperscan",
        "mattel_hyperscan_alt",
        "mattel_intellivision_49_75011",
        "mattel_intellivision_5872",
        "microsoft_xbox_360_digital",
        "microsoft_xbox_360_e",
        "microsoft_xbox_360_s",
        "microsoft_xbox_one",
        "microsoft_xbox_one_s",
        "microsoft_xbox_one_x_k",
        "microsoft_xbox_series_x",
        "microw8",
        "milton_bradley_microvision",
        "nec_pc_98",
        "nichibutsu_my_vision",